{
  "schema_version": 1,
  "turn": 10,
  "in_world_date": {
    "day": 1,
    "month": "Seedmonth",
    "year": 1
  },
  "status": [
    "twisted ankle, favors it going down stairs"
  ],
  "magic": [
    "lingering warmth from a healer's working on his ankle, fading over the next few days"
  ],
  "gear": [
    {
      "name": "T-shirt",
      "acquired_turn": 0,
      "acquired_event": "Baseline starting clothes"
    },
    {
      "name": "Jeans",
      "acquired_turn": 0,
      "acquired_event": "Baseline starting clothes"
    },
    {
      "name": "Underwear",
      "acquired_turn": 0,
      "acquired_event": "Baseline starting clothes"
    },
    {
      "name": "Socks",
      "acquired_turn": 0,
      "acquired_event": "Baseline starting clothes"
    },
    {
      "name": "Shoes",
      "acquired_turn": 0,
      "acquired_event": "Baseline starting clothes"
    },
    {
      "name": "Traveler's cloak",
      "acquired_turn": 1,
      "acquired_event": "Given by an innkeeper against the cold"
    }
  ],
  "currency": {
    "copper": 14,
    "silver": 2,
    "gold": 0,
    "platinum": 0
  },
  "language": {
    "established": true,
    "detail": "Common tongue, learned by ear over the first days"
  },
  "npc_relationships": [
    {
      "npc_id": "innkeeper-maren",
      "name": "Maren",
      "disposition": "wary but not unkind",
      "note": "Runs the inn where Chad first woke; gave him the cloak."
    }
  ],
  "open_threads": [
    {
      "text": "Maren wants payment for the room by the week's end",
      "added_turn": 5,
      "active": true,
      "deadline_turn": 12
    }
  ],
  "throughline": [
    "Starting to plan more than one step ahead, instead of just reacting"
  ],
  "entities": [
    {
      "name": "The Hollow Bell",
      "type": "location",
      "note": "The inn Maren runs"
    }
  ],
  "continuity_notes": [
    "Corrected day count after a skipped in-world date on turn 7"
  ],
  "commit_token": "10-00f637"
}
